Job Title,Location,Employer
"BERGEN COUNTY, NEW JERSEY","Bergen County, New Jersey",Aspen Medical Associates
"INTERNAL MEDICINE, OUTPATIENT ONLY, HOSPITALIST",Colorado,Mountain Medical Group
"GASTROENTEROLOGIST, CONNECTICUT",Connecticut,confidential
INTERVENTIONAL CARDIOLOGIST,New Orleans suburb,Ochsner Clinic
OUTSTANDING CLINICAL AND LEADERSHIP POSITIONS,"Needham, MA","Beth Israel Deaconess Medical Center, Division of General Medicine and Primary Care"
"INTERNAL MEDICINE POSITION, BRONX, NY","Bronx, New York",Saint Barnabas Hospital
ERICKSON HEALTH MEDICAL GROUP,"Hingham, Massachusetts",Erickson Living
"NORTH CAROLINA, ASSISTANT PROFESSOR","Greensboro, NC",Cone Health
"BUEHLER CENTER ON AGING, HEALTH, AND SOCIETY, DIRECTOR",Chicago,"Northwetsern University Feinberg School of Medicine, Buehler Center"
"NIH FUNDED INVESTIGATOR, NYU SCHOOL OF MEDICINE","New York, NY",New York University Medical Center
IMMEDIATE OPENING FOR ONE BC/BE GASTROENTEROLOGIST,Northeast Iowa,Cedar Valley Medical Specialists
"APOGEE PHYSICIANS, NATIONWIDE HOSPITALIST OPPORTUNITIES",Nationwide,Apogee Physicians
NOCTURNIST HOSPITALIST NEEDED,"Metro Detroit, Michigan",confidential
HOSPITALIST,Massachusetts,Confidential
SOUTHCOAST MEDICAL GROUP,"Savannah, Georgia",Southcoast Medical Group
"ENDOCRINE, CONNECTICUT",Connecticut,Confidential
"FAMILY MEDICINE AND URGENT CARE, NEW HAMPSHIRE",New Hampshire,Confidential
"INVASIVE NONINTERVENTIONAL CARDIOLOGY, SPRINGFIELD AREA",Massachusetts,Confidential
"INTERNAL MEDICINE, MASSACHUSETTS",Massachusetts,Confidential
"FAMILY PRACTICE, NEW HAMPSHIRE",New Hampshire,Confidential
"GASTROENTEROLOGY, NEW HAMPSHIRE",New Hampshire,Confidential
"SAINT JOSEPH, MISSOURI EXCEPTIONAL OPPORTUNITY",Missouri,Saint Joseph Oncology
"INTERNAL MEDICINE, NORTH OF BOSTON",Massachusetts,Confidential
"RHEUMATOLOGY, NEW YORK",New York,Confidential
"THE BERKSHIRES, WESTERN MASSACHUSETTS","Beautiful Berkshires, Massachusetts",Berkshire Health Systems
"ENDOCRINE, RHODE ISLAND",Rhode Island,Confidential
"INTERNAL MEDICINE, RHODE ISLAND",Rhode Island,Confidential
"CARDIOLOGIST, METROPOLITAN BOSTON AREA",Metropolitan Boston area,South Shore Cardiology
"BOARD-CERTIFIED PHYSICIAN, SARATOGA INTERNAL MEDICINE ASSOCIATES","Saratoga Springs, New York",Community Care Physicians
"INFECTIOUS DISEASE, RHODE ISLAND",Rhode Island,Confidential
"INTERNAL MEDICINE, NEW HAVEN REGION/FAIRFIELD COUNTY",Connecticut,Confidential
"FAMILY MEDICINE, CONNECTICUT",Connecticut,Confidential
"HEMATOLOGY/ONCOLOGY, RHODE ISLAND",Rhode Island,Confidential
"FAMILY PRACTICE, MASSACHUSETTS",Massachusetts,New England Physician Recruitment Center
ELECTROPHYSIOLOGY CARDIOLOGY AND GENERAL CARDIOLOGY NEEDED,Western Massachusetts,Confidential
"INFECTIOUS DISEASE, CONNECTICUT",Connecticut,Confidential
"VICE CHAIR, CLINICAL AFFAIRS, DEPARTMENT OF MEDICINE",Boston,Boston University School of Medicine
JOHNS HOPKINS ACADEMIC HOSPITAL MEDICINE,"Baltimore, Maryland",Johns Hopkins Bayview Medical Center
"SANSUM CLINIC, SANTA BARBARA","Santa Barbara, California",Sansum Clinic
PENTUCKET MEDICAL ASSOCIATES IS SEEKING AN INTERNIST,"North Shore, Massachusetts","Olesky Associates, Inc."
"METROWEST BOSTON, AN EXCEPTIONAL IM OPPORTUNITY",Massachusetts,"Olesky Associates, Inc."
RARE IM OPPORTUNITY NORTH OF BOSTON,Massachusetts,"Olesky Associates, Inc."
"METROWEST BOSTON, AN EXCEPTIONAL FAMILY PRACTICE OPPORTUNITY",Massachusetts,"Olesky Associates, Inc."
HOSPITALIST NEEDED,SOUTH JERSEY,Lisa Rink Family Medicine
PRIMARY CARE PHYSICIAN,Southeast New Mexico,Kymera Independent Physicians
ENDOCRINOLOGIST IN SE NEW MEXICO.,Southeast New Mexico,Kymera Independent Physicians
"CHIEFS, INTERNAL MEDICINE, PEDIATRICS, NEW YORK",New York,Confidential
"PULMONARY/CRITICAL CARE, OR CRITICAL CARE ONLY, NEW YORK",New York,Confidential
"CHIEF OF MEDICINE, MINNEAPOLIS VA HEALTH CARE SYSTEM","Minneapolis, Minnesota",VAMC Minneapolis
ACADEMIC PULMONARY INTENSIVIST/TELE-INTENSIVIST,"Minneapolis, Minnesota",VAMC Minneapolis
FACULTY POSITION IN CELL AND MOLECULAR BIOLOGY,"San Francisco, California","University of California San Francisco, Lung Biology"
EXCEL. WE CAN MAKE THAT HAPPEN. PERIOPERATIVE MEDICINE,"Hartford, Connecticut",Saint Francis Hospital and Medical Center
"DIVISION DIRECTOR, DIVISION OF PULMONARY AND CRITICAL CARE","Charleston, South Carolina","Medical University of South Carolina, Department of Medicine"
INPATIENT CLINICIAN EDUCATORS,Boston,"Massachusets General Hospital, Dept Medicine"
CLINICAL CARDIAC  ELECTROPHYSIOLOGIST,"Clearwater, Florida",Clearwater Cardiovascular/Interventional Cons
ACADEMIC DIVISION CHIEF,"Philadelphia, Pennsylvania",Drexel University College of Medicine
"FACULTY POSITION, DIVISION OF ACUTE CARE SURGERY",Boston,"Beth Israel Deaconess Medical Center, Acute Care"
"SENIOR CLINICIAN, DERMATOLOGY BRANCH",Bethesda,"National Institutes of Health, NCI, Dermatology"
HOSPITALIST OPENING FOR MED/PED  &  NOCTURNIST POSITION FOR INTERNIST,North Carolins resort community,Jackson & Coker
"HAMPDEN COUNTY PHYSICIAN ASSOCIATES, LLC",Western Massachusetts,"Hampden County Physician Associates, LLC"
"NEUROLOGY, FACULTY APPOINTMENT, SALARY, UNIVERSITY TOWN",West Virginia,Jackson & Coker
"BENIGN HEMATOLOGY FACULTY POSITIONS, PENN STATE COLLEGE OF MEDICINE","Hersshey, Pennsylvania",Jackson & Coker
"NORTH CAROLINA NEUROLOGY OPENING, EARN 500K",North Carolina,Jackson & Coker
"INTERNAL MEDICINE POSITION, IDEAL MIDWESTERN LOCATION",Nebraska,Jackson & Coker
FAMILY PRACTICE: 275K+ COMPENSATION,Texas,Jackson & Coker
THE UNIVERSITY OF CONNECTICUT,Connecticut,The University of Connecticut
MERCY MEDICAL CENTER IN SPRINGFIELD MASSACHUSETTS,"Springfield, Massachusetts",Mercy Medical Center
"HEMATOLOGY/ONCOLOGY, CLEARWATER, FLORIDA","Clearwater, Florida",Morton Plant Mease BayCare Health System
THIRTY YEARS OF CARDIOLOGY,Northern California,CONFIDENTIAL
ASSOCIATE OR FULL PROFESSOR,"San Diego, California","University of California San Diego, Department of Neurology"
"HOSPITALIST, HAMILTON MEDICAL CENTER, DALTON, GEORGIA","Dalton, Georgia",TeamHealth
"HOSPITALIST, ST. JOSEPH HOSPITAL, EUREKA, CALIFORNIA","Eureka, California",TeamHealth
"HOSPITALIST, HALLMARK HEALTH SYSTEM, MELROSE AND MEDFORD MASSACHUSETTS","Melrose & Medford, Massachusetts",TeamHealth
"MEDICAL DIRECTOR, ST. FRANCIS HOSPITAL, CHARLESTON, WEST VIRGINIA","Charleston, West Virginia",TeamHealth
"HOSPITALIST, FRANKFORT REGIONAL MEDICAL CENTER, FRANKFORT, KENTUCKY","Frankfort, Kentucky",TeamHealth
"HOSPITALIST, TEXAS HEALTH HARRIS METHODIST HOSPITAL, CLEBURNE, TEXAS","Cleburn, Texas",TeamHealth
CHAIR OF THE DEPARTMENT OF SURGERY AT OLIVE VIEW-UCLA MEDICAL CENTER,Los Angeles,UCLA Medical Center
TOLEDO FAMILY MEDICINE,"Toledo, Ohio","TimeLine Recruiting, LLC"
"RIGHTTIME MEDICAL CARE, PHYSICIAN CAREER OPPORTUNITIES",Maryland,Righttime Medical Care
"DIVISION DIRECTOR, GENERAL INTERNAL MEDICINE","Columbus, Ohio","Ohio State University, Department of Internal Medicine"
MASSACHUSETTS GENERAL HOSPITAL CANCER CENTER,Boston,Massachusetts General Hospital Cancer Center
DIVISION OF HEMATOLOGY/ONCOLOGY,Boston,Massachusetts General Hospital Cancer Center
ACADEMIC DIABETES,"Worcester, Massachusetts",UMass Memorial Medical Center
ASSISTANT OR ASSOCIATE PROFESSORS,"El Paso, Texas",Texas Tech University Health Sciences (Dept of Biometical Sciences)
FACULTY POSITION IN NEURO-ONCOLOGY,Boston,Massachusetts General Hospital Cancer Center
QUALITY OF LIFE,Massachusetts,Harvard Vanguard Medical Associates
HOSPITALIST,"Lebanon, New Hampshire",Dartmouth-Hitchcock Medical Center
"EXCEPTIONAL OPPORTUNITIES, CHICAGO'S NORTHERN SUBURBS","Chicago, Illinois",NorthShore University HealthSystem
"EXPLORE NEW HORIZONS, BEEBE MEDICAL CENTER",Delaware,Beebe Medical Center
NEPHROLOGIST WANTED,Chicagoland,Northwest Kidney Care
"PRIMARY CARE, INTERNAL MEDICINE, AND FAMILY MEDICINE",New York,Methuselah Medical Services
"INTERNAL MEDICINE, PRINCETON, NJ AREA","Princeton, New Jersey",Hightstown Medical Associates
SEEKING HIGHLY QUALIFIED BC/BE INTERNIST/GERIATRICIAN,"Essex County, New Jersey",Newark Clinic
NORTHERN VIRGINIA,Northen Virginia,confidential
"ST. LUKE'S-ROOSEVELT, NYC","New York, New York",Saint Luke's Roosevelt
"ELECTROPHYSIOLOGIST OPPORTUNITY, UPSTATE NEW YORK",Upstate New York,"Cardiology Associates of Schenectady, PC"
TWO INTERNAL MEDICINE HOSPITALISTS ARE NEEDED,New Jersey,"Healthcare Staffing Solutions, Inc"
"PHYSICIAN, CHIEF OF MEDICINE SERVICE",Central Arkansas,VAMC Central Arkansas
THE UCLA HOSPITALIST SERVICE,Los Angeles,UCLA
"HOSPITALIST DIRECTOR AND STAFF POSITIONS, SUBURBAN PITTSBURGH",Suburban Pitttsburgh,"TimeLine Recruiting, LLC"
"ORTHOPAEDIC SPINE, 100%, TWIN CITIES PARTNERSHIP","Minneapolis, Minnesota","TimeLine Recruiting, LLC"
"CHAIR, DEPARTMENT OF PEDIATRICS, SCHOOL OF MEDICINE","Morgantown, West Virginia",West Virginia University
RHEUMATOLOGIST,Westchester County,confidential
FAMILY PRACTICE,"Hamptons, Long Island, New York",Meeting House Lane Medical Practice PC
INTERNAL MEDICINE,"Hamptons, Long Island, New York",Meeting House Lane Medical Practice PC
THE DIVISION OF IMMUNOTHERAPY AND AUTOIMMUNE DISEASES,Chicago,"Northwestern University, Division of Immunotherapy"
"BILLINGS CLINIC, INFECTIOUS DISEASES","Billings, Montana",Mountain Medical Group
NONINVASIVE CARDIOLOGIST NEEDED,New Jersey,Heart and Vascular Associates of NJ
BOARD CERTIFIED INTERNIST OR FAMILY PRACTITIONER,Northern New Jersey,Heart and Vascular Associates of NJ
BOARD CERTIFIED INTERNIST OR FAMILY PRACTITIONER,Northern New Jersey,Heart and Vascular Associates of NJ
"JOHNS HOPKINS SCHOOL OF MEDICINE, VICE DEAN FOR EDUCATION","Baltimore, Maryland","Johns Hopkins University, Office of the Dean"
INTERNAL MEDICINE POSITIONS NORTH OF BOSTON,"Massachusetts, North of Boston",Hallmark Health Medical Associates
FAMILY MEDICINE POSITIONS NORTH OF BOSTON,"Massachusetts, North of Boston",Hallmark Health Medical Associates
OB/GYN POSITIONS NORTH OF BOSTON,"Massachusetts, North of Boston",Hallmark Health Medical Associates
SEEKING BC/BE NEPHROLOGIST,Near San Francisco,Diablo Nephrology Medical Group
"MEDICAL DIRECTOR, AMBULATORY SERVICES","Hartford, Connecticut",Saint Francis Hospital and Medical Center
ACADEMIC CARDIOLOGIST,"Syracuse, New York",SUNY Upstate Medical University
VASCULAR NEUROLOGIST,"Lebanon, New Hampshire",Dartmouth-Hitchcock Medical Center
"COLORADO, PUEBLO","Pueblo, Colorado",US Oncology
"PRIMARY CARE, CONNECTICUT",Connecticut,Saint Francis Hospital and Medical Center
PRIMARY CARE MEDICAL DIRECTOR,"Hartford, Connecticut",Saint Francis Hospital and Medical Center
CARDIOLOGY,New Jersey,Raritan Bay Cardiology Group
BC/BE PHYSICIAN,New Jersey,Raritan Bay Cardiology Group
BC/BE ENDOCRINOLOGIST/ENDO #1,New Jersey,Raritan Bay Cardiology Group
THE MEDICAL DEPARTMENT AT MASSACHUSETTS HOSPITAL SCHOOL (MHS),Massachusetts,Massachusetts Hospital School
BC/BE UROLOGIST IS NEEDED,"Cedar City, Utah",Intermountain Healthcare
INTERMOUNTAIN HEALTHCARE IS SEEKING TO ADD A THIRD NEUROLOGIST,"St. George, Utah",Intermountain Healthcare
TWO BC/BE HOSPITALISTS SOUGHT TO JOIN EXPANDING GROUP,"St. George, Utah",Intermountain Healthcare
BC/BE NONINVASIVE OR CARDIAC IMAGING CARDIOLOGIST,"St. George, Utah",Intermountain Healthcare
"EMPLOYED FAMILY MEDICINE POSITION, NEW JERSEY SHORE","New Jersey Shore, New Jersey",Virtua Health System
"BOICE-WILLIS CLINIC (NEAR RALEIGH, NC)","Near Raleigh, North Carolina",Boice-Willis Clinic
BC/BE NEPHROLOGIST,Chicago Suburb,confidential
GASTROENTEROLOGIST BC/BE WANTED,"Suffolk County, Long Island",confidential
WEILL CORNELL MEDICAL COLLEGE,New York,Weill Cornell Medical College
SEVENTH INTERNIST FOR MULTIDISCIPLINARY COMMUNITY HEALTH CENTER,90 Minutes from Washington and Baltimore,Shenandoah Valley Medical System
SEEKING HIGHLY QUALIFIED BC/BE INTERNIST/GERIATRICIAN,"Essex County, New Jersey",Prime Heart Clinic
"PROMINENT, ESTABLISHED LARGE NEPHROLOGY GROUP",Northeast Oklahoma,confidential
TWO GI PHYSICIAN PRACTICE SEEKING GI,"Raleigh, North Carolina",Gastrointestinal Healthcare
"INTERNAL MEDICINE, CONNECTICUT",Connecticut,Confidential
"MEDICAL DIRECTOR, SOUTHEASTERN CONNECTICUT",Connecticut,Confidential
"ENDOCRINE, CONNECTICUT",Connecticut,Confidential
"HOSPITALIST, INDIANA","Fort Wayne, Indiana",Lutheran Hospital
PEDIATRICS,Massachusetts,Confidential
"INTERNAL MEDICINE, CONNECTICUT",Connecticut,Confidential
"HOLLOMAN AIR FORCE BASE, NEW MEXICO","Alamogordo, New Mexico",Holloman Air Force Base
"INTERNAL MEDICINE, RHODE ISLAND",Rhode Island,New England Physician Recruitment Center
"FAMILY PRACTICE, CONNECTICUT",Connecticut,Confidential
"URGENT CARE, MASSACHUSETTS",Massachusetts,New England Physician Recruitment Center
INTERNAL MEDICINE,Massachusetts,Confidential
CHIEF OF GENERAL MEDICINE AND PRIMARY CARE,Boston,Tufts Medical Center
INFECTIOUS DISEASE FACULTY POSITION,Philadelphia,Drexel University College of Medicine
"HOSPITALIST, NEW HAMPSHIRE",New Hampshire,New England Physician Recruitment Center
"OGDEN, UTAH","Ogden, Utah",Intermountain Healthcare
"HEMATOLOGY/ONCOLOGY, MASSACHUSETTS",New England,New England Physician Recruitment Center
"HOSPITALIST, MASSACHUSETTS",Massachusetts,COnfidential
"HOSPITALIST, CONNECTICUT",Connecticut,Confidential
BOSTON REGION,Massachusetts,New England Physician Recruitment Center
"HOSPITALIST, PENNSYLVANIA",Pennsylvania,New England Physician Recruitment Center
"HOSPITALIST, NEW YORK",New York,New England Physician Recruitment Center
"HOSPITALIST, MAINE",Maine,Confidential
"HOSPITALIST, RHODE ISLAND",Rhode Island,New England Physician Recruitment Center
"HOUSTON, TEXAS","Houston, Texas",Confidential
"OPPORTUNITY FOR NOCTURNIST, HOSPITAL MEDICINE",Boston Suburb,Emerson Hospital
PULMONOLOGY/CRITICAL CARE/SLEEP MEDICINE,Boston Suburb,Emerson Hospital
MASSACHUSETTS GENERAL HOSPITAL,Boston,"Massachusetts General Hospital, Division of Cardiology"
YOU KNOW WHAT YOU WANT IN A PRACTICE,Western Massachusetts,Baystate Health
HOSPITALISTS,New Haven,Yale-New Haven Hospital
NORTHEAST OHIO INFECTIOUS DISEASE ASSOCIATES,Northeast Ohio,Northeast Ohio Infectious Disease Associates
EMPLOYED FAMILY MEDICINE POSITION,Southern New Jersey,Cejka Search for Virtua Health System
"HARRISBURG, PENNSYLVANIA","Harrisburg, Pennsylvania",confidential
"SALT LAKE CITY, UTAH","Salt Lake City, Utah",Intermountain Healthcare
MULTISPECIALTY GROUP IN THE BRONX,"The Bronx, New York",confidential
LEAD AND STAFF HOSPITALIST POSITIONS,Southeastern Pennsylvania,Cejka Search
UNIVERSITY OF MARYLAND HEMATOLOGY,"Baltimore, Maryland",University of Maryland
"THE UNIVERSITY OF CINCINNATI, DIVISION OF CARDIOVASCULAR DISEASES","Cincinnati, Ohio","University of Cincinnati, Cardiology"
THE HOSPITAL MEDICINE UNIT AT MASSACHUSETTS GENERAL HOSPITAL,Boston,"Massachusetts General Hospital, Hospital Medicine"
"IMPROVING PEOPLES LIVE, INCLUDING YOUR OWN",Utah,Intermountain Healthcare
PHYSICIANS: THE HEART OF OUR OPERATION,Central Massaschusetts,"PracticeMatch Services, LLC"
Emergency Medicine Physician - Army Reserve,Nationwide,US Army
Family Practice Physician,Nationwide,US Army
Family Practice Physician - Army Reserve,Nationwide,US Army
General Surgeon,Nationwide,US Army
General Surgeon - Army Reserve,Nationwide,US Army
Internal Medicine Physician,Nationwide,US Army
Orthopedic Surgeon - Army Reserve,Nationwide,US Army
Psychiatrist,Nationwide,US Army
Psychiatrist - Army Reserve,Nationwide,US Army
Thoracic Surgeon - Army Reserve,Nationwide,US Army
Emergency Medicine Physician,Nationwide,US Army
"INTERNAL MEDICINE AND FAMILY MEDICINE,  MASSACHUSETTS",South Shore of Massachusetts,"South Shore Medical Center, Inc"
"INTERNAL MEDICINE AND FAMILY MEDICINE,  MASSACHUSETTS",South Shore of Massachusetts,"South Shore Medical Center, Inc"
NORTH CENTRAL FLORIDA NEPHROLOGY PRACTICE,North Central Florida,"Nephrology Associates of North Central Florida, PA"
MASSACHUSETTS: PREMIER PACE PROGRAM,Massachusetts,AMN Healthcare
HOSPITALIST NEEDED,"Louisville, Kentucky",Midwest Infectious Disease
INFECTIOUS DISEASE PHYSICIAN,"Louisville, Kentucky",Midwest Infectious Disease
"SOUTHERN FLORIDA, PALM BEACH COUNTY","Southern Florida, Palm Beach County","Joshua and Joshua, MD, PA"
INTERNAL MEDICINE PHYSICIAN,Long Island,"Advanced Internal Medicine Group, PC"
FLORIDA'S WEST COAST OPPORTUNITY,Tampa Bay Area,Cancer Center of Pasco Pinellas
"FAMILY PRACTICE, MASSACHUSETTS",Massachusetts,Confidential
"INTERNAL MEDICINE, MASSACHUSETTS",Massachusetts,Confidentail
HOSPITALIST,Connecticut,Confidential
GERIATRICS,Massachcusetts,Confidential
INTERNAL MEDICINE,Massachusetts,Confidential
"INTERNAL MEDICINE, MASSACHUSETTS",Massachcusetts,New England Physician Recruitment Center
"ENDOCRINOLOGY, NEW YORK",New York,Confidential
"GENERAL SURGERY, NEW HAMPSHIRE",New Hampshire,Confidential
"GASTROENTEROLOGY, NEW HAMPSHIRE",New Hampshire,Confidential
"GASTROENTEROLOGY, NEW YORK",New York,Confidential
"INTERNAL/FAMILY MEDICINE, CONNECTICUT",Connecticut,"StayWell Health Care, Inc."
PEDIATRIC URGENT CARE MOONLIGHTERS (WEEKEND),Greater Boston Area,Harvard Vanguard Medical Associates
NEW JERSEY PARTNERSHIP OPPORTUNITY (SHORE AREA),New Jersey Shore,"Jersey Shore Medical and Pediatric Associates, LLC"
ELECTROPHYSIOLOGIST,"Rochester, NY",Rochester General Health System
ONCOLOGIST,"Long Island, NY",Staten Island Physician Practice
ELECTROPHYSIOLOGIST,"Rochester, NY",Rochester General Health System
INTERNAL MEDICINE/FAMILY MEDICINE,"Plymouth, MA","PMG Physician Associates, PC"
"NC AHEC PROGRAM DIRECTOR, EXECUTIVE ASSOCIATE DEAN","Chapel Hill, North Carolina",University of North Carolina at Chapel Hill
"WASHINGTON, DC, AREA'S PREMIER HOSPITALIST GROUP","Washington, DC",Inpatient Specialists
DIVISION DIRECTOR POSITION,"Silver Spring, Maryland",Food and Drug Administration
Family Physician,Not Available,Arlington Family Practice
"INTERNAL MEDICINE OR GERIATRIC OPPORTUNITIES, WESTERN WASHINGTON",Western Washington,MultiCare Health System
"INTERNAL MEDICINE AND IM/PEDS OUTPATIENT OPPORTUNITIES, NC","Charlotte, North Carolina region",Novant Health
COASTAL NC IM OP OPPORTUNITY,North Carolina coast,Novant Health
"BEHAVIORAL NEUROLOGIST NEEDED IN CHARLOTTE, NC","Charlotte, North Carolina",Novant Health
"NEUROLOGIST EMG, (NC)","Salisbury, North Carolina",Novant Health
"BEHAVIORAL NEUROLOGIST, CHARLOTTE, NC","Charlotte, North Carolina",Novant Health
PSYCHIATRY OPPORTUNITIES IN NORTH CAROLINA,North Carolina,Novant Health
"NATIONAL JEWISH HEALTH, PULMONARY MEDICINE OPPORTUNITY","Denver, Colorado",Rocky Mountain Medical Search
"Hospitalist, Moonlighting Positions, National Jewish Health","Denver, Colorado",Rocky Mountain Medical Search
"Allergy/Immunology, National Jewish Health","Denver, Colorado",Rocky Mountain Medical Search
"Fuller Roberts Clinic (www.hrhs.org) in South Boston, Virginia","South Boston, Virginia",Halifax Regional Health System
Family Practice Physician in charming southern Virginia!,Not Available,Halifax Regional Health System
"Orthopedic Surgeon, employed in southern Virginia",Not Available,Halifax Regional Health System
HOSPITALISTS,Western Massachusetts,Cooley Dickinson Hospital
FAMILY MEDICINE PHYSICIANS,Western Massachusetts,Cooley Dickinson Hospital
"ADCARE HOSPITAL OF WORCESTER, INC., ADDICTION MEDICINE, FULL-TIME","Worcester, Massachusetts",AdCare Hospital of Worcester
"ADCARE HOSPITAL OF WORCESTER, INC. HOSPITALIST-ADDICTION","Worcester, Massachusetts",AdCare Hospital of Worcester
ASSISTANT CLINICAL INVESTIGATOR,"Bethesda, Maryland",National Cancer Institute/NIH
PAIN AND PALLIATIVE CARE SERVICE,"New York, New York",Memorial Sloan-Kettering Cancer Center
"ACADEMIC NEUROLOGISTS, UMASS MEMORIAL MEDICAL CENTER","Worcester, Massachusetts",UMass Memorial Medical Center
"FAMILY MEDICINE PHYSICIANS, BEAUTIFUL NEWPORT","Newport, Rhode Island",Newport Hospital
INTERVENTIONAL CARDIOLOGIST,New Orleans suburb,Ochsner Clinic
INTERNAL MEDICINE,Massachcusetts,Confidential
PHYSICIAN-OWNED OHIO PRACTICE,Ohio,"Medical Associates of Cambridge, Inc."
"NEW HOSPITALIST PROGRAM LOCATED IN KEY WEST, FLORIDA","Key West, Florida","Hospitalist Alliance, LLC"
PART-TIME OR FULL-TIME IN CONNECTICUT,Connecticut,"HeartCare Associates of Connecticut, Inc."
BUSY CARDIOLOGY PRACTICE IN BROOKLYN,"Brooklyn, NY",Amber Heart Medical
"NONINVASIVE CARDIOLOGY, CENTRAL MAINE",Maine,Confidential
"HOSPITALIST, NEW HAMPSHIRE",New Hampshire,Confidential
"INTERNAL MEDICINE, CONNECTICUT",Connecticut,Confidential
"HEMATOLOGY/ONCOLOGY, RHODE ISLAND","Rhode Island. Massachusetts, New Hampshire",New England Physician Recruitment Center
"HOSPITALIST, MASSACHUSETTS",Massachusetts,Confidential
"CRITICAL CARE, RHODE ISLAND",Rhode Island,Confidential
"HOSPITALIST, CONNECTICUT",Connecticut,Confidential
"GASTROENTEROLOGIST, NEW YORK CITY","New York, Connecticut, Massachusetts",New England Physician Recruitment Center
"HOSPITALIST, BOSTON",Massachusetts,Confidential
KENTUCKY,Kentucky,Buecker Enterprises Inc.
CHIEF OF THE MEDICAL SERVICE,New York City,"NYU School of Medicine, Department of Medicine"
"SE FLORIDA, BE/BE NEPHROLOGIST","Boca Raton/Delray Beach, Florida",Confidential
A GROWING SINGLE SPECIALTY PRACTICE,"Orlando, Florida",confidential
CLINIC PHYSICIAN,"Little Rock, Arkansas",University of Arkansas for Medical Sciences
HOSPITALISTS,"Little Rock, Arkansas",University of Arkansas for Medical Sciences
NEPHROLOGIST,New York,Staten Island Physician Practice
"LAKES, MOUNTAINS, SEACOAST, AND BOSTON ALL WITHIN ONE HOUR",Seacoast New Hampshire,Frisbie Memorial Hospital
NEPHROLOGY OPPORTUNITY IN CENTRAL GEORGIA,Central Georgia,confidential
BC/BE GASTROENTEROLOGIST,"Bronx, NY","Saint Barnabas Hospital, Gastroenterology"
CHAIR OF NEUROSURGERY,Central Texas,Hodges Partners
PULMONARY/CRITICAL CARE AND CRITICAL CARE OPPORTUNITIES,Northeastern Pennsylvania,Geisinger Health Systems
EVMS GENERAL INTERNAL MEDICINE,Virginia,Eastern Virginia Medical School
CHIEF OF HEMATOLOGY,"Philadelphia, Pennsylvania",Drexel University College of Medicine
ASSISTANT OR ASSOCIATE PROFESSOR FACULTY HEMATOLOGY AND ONCOLOGY,"Philadelphia, Pennsylvania",Drexel University College of Medicine
SAN DIEGO HOSPITALIST POSITION AVAILABLE,"San Diego, California",San Diego Critical Care Medical Group
NEW JERSEY,Southern New Jersey,"Hematology/Oncology Associates, PA"
NEPHROLOGIST POSITION AVAILABLE,Atlanta suburbs,"Nephrology, Inc."
"MISSOURI, ST. LOUIS","St. Louis, Missouri",US Oncology
FAMILY PRACTICE OR INTERNAL MEDICINE PHYSICIAN,Kentucky,confidential
FAMILY PRACTICE PHYSICIANS,New York City,confidential
NJ CARDIOLOGY,New Jersey,confidential
"CLEVELAND, OHIO","Cleveland, Ohio",MetroHealth Medical Center
"CARDIOLOGY, NEW JERSEY",Central New Jersey,confidential
"HOSPITALIST, DIVISION OF HOSPITAL MEDICINE","Washington, DC",Georgetown University Hospital
"URGENT CARE, CONNECTICUT",Connecticut,Confidential
"INTERNAL MEDICINE, CONNECTICUT",Connecticut,Confidential
"GERIATRICS, CONNECTICUT",Connecticut,Confidential
"INTERNAL MEDICINE, MASSACHUSETTS",Massachusetts,Confidential
"HEART FAILURE CARDIOLOGIST, DARTMOUTH",New Hampshire,Confidential
"INTERNAL MEDICINE, RHODE ISLAND",Rhode Island,Confidential
"INFECTIOUS DISEASE, RHODE ISLAND",Rhode Island,Confidential
"CARDIOLOGY, NEW YORK",New York,Confidential
"GASTROENTEROLOGIST, MAINE",Maine,Confidential
"HEMATOLOGY/ONCOLOGY, RHODE ISLAND",Rhode Island,Confidential
"HOSPITALIST, CONNECTICUT",Connecticut,Confidential
"PULMONARY/CRITICAL CARE, MASSACHUSETTS",Massachsuetts,Confidential
"GENERAL SURGERY, RHODE ISLAND",Rhode Island,Confidential
"HOSPITALIST, CONNECTICUT",Connecticut,Confidential
CHICAGO PHYSICIAN INTERESTED IN WORKING IN AN EXECUTIVE HEALTHCARE ENVIRONMENT,"Chicago, Illinois",EHE International
"HOSPITALIST OPENINGS, BURLINGTON, MASSACHUSETTS","Burlington, Massachusetts",Lahey Clinic
"GENERAL SURGEON, SUBURBAN ATLANTA","Suburban Atlanta, Georgia",WellStar Health System
"GYNECOLOGIC ONCOLOGIST, SUBURBAN ATLANTA","Suburban Atlanta, Georgia",WellStar Health System
"INTERNAL MEDICINE PHYSICIAN, SUBURBAN ATLANTA","Suburban Atlanta, Georgia",WellStar Health System
"FAMILY MEDICINE PHYSICIAN, SUBURBAN ATLANTA","Suburban Atlanta, Georgia",WellStar Health System
"THE BERKSHIRES, WESTERN MASSACHUSETTS",Berkshires of Western Massachusetts,Berkshire Health Systems
CENTRAL ILLINOIS HEMATOLOGY ONCOLOGY (CIHOC),Central Illinois,Central Illinois Hematology/Oncology Center
"NEW JERSEY, NEAR PRINCETON AREA","Princeton, New Jersey",EP Medical Associates
OVERLAKE INTERNAL MEDICINE ASSOCIATES,"Bellevue, Washington",Overlake Internal Medicine Associates
"BC/BE NONINVASIVE CARDIOLOGIST-HARRISBURG, PENNSYLVANIA","Harrisburg, Pennsylvania",Pinnacle Health Cardiovascular
MEDICAL ONCOLOGIST/CLINICAL INVESTIGATOR,"New York, New York",Memorial Sloan-Kettering Cancer Center
GENERAL INTERNAL MEDICINE,"Baltimore, Maryland","Sinai Hospital of Baltimore, Internal Medicine"
BUSY NEPHROLOGY PRACTICE,45 Minutes East of Atlanta,NGNC
"HOSPITALIST, BAR HARBOR, MAINE","Bar Harbor, Maine",Maine Recruitment Center
"TRANSPLANT INFECTIOUS DISEASES, FELLOWSHIP",Pittsburgh,"University of Pittsburgh, Division of Infectious Disease"
"SOUTHEASTERN MASSACHUSETTS, PC PHYSICIAN",Southeastern Massachusetts,Shriver Clinical Services Corporation
ENDOCRINOLOGIST,Virginia,Eastern Virginia Medical School
THE UNIVERSITY OF NEW MEXICO,"Albuquerque, New Mexico",University of New Mexico HSC
NEPHROLOGIST NEEDED IN GEORGIA,Southwest Georgia,confidential
LARGE HEMATOPOIETIC STEM CELL TRANSPLANT  AND LEUKEMIA PROGRAM,"Atlanta, Georgia",Blood & Marrow Transplant Group of Georgia
"EXCEPTIONAL OPPORTUNITY, 45 MINUTES FROM NYC",Central New Jersey,Marlboro Medical Center
"INTERNAL MEDICINE, SOUTH EASTERN CONNECTICUT",Southeastern Connecticut,"Internal Medicine Group, LLC"
PINNACLE HEALTH SYSTEM,"Harrisburg, Pennsylvania",Pinnacle Health Hospital
"FLORIDA, INTERVENTIONAL/PV CARDIOLOGIST","Clearwater, Florida",Clearwater Cardiovascular/Interventional Cons
"THE BERKSHIRES, WESTERN MASSACHUSETTS","The Berkshires, Western Massachusetts",Berkshire Health Systems
