Job Title,Location,Employer
OKLAHOMA KIDNEY CARE,Oklahoma City,Oklahoma Kidney Care
"GI PRACTICE IN WESTCHESTER, NY","Westchester, New York",confidential
DIRECTOR OF HEMATOLOGIC MALIGNANCIES,Boston,Massachusetts General Hospital Cancer Center
"PULMONARY/CRITICAL CARE, FORT LAUDERDALE","Fort Lauderdale, Florida",Broward Pulmonary and Sleep Specialists
ACADEMIC HOSPITALIST FACULTY POSITION,Southeastern Pennsylvania,The Reading Hospital and Medical Center
"UP TO $150,000 IN LOAN REPAYMENT","Geneva, New York",Finger Lakes Health
NEPHROLOGIST BC/BE,Upstate New York,Nephrology Hypertension Associates of CNY
"IM/FP NEEDED F/T, BC/BE","Princeton, New Jersey Area",confidential
HOSPITALIST POSITION AVAILABLE,"Palo Alto, California",VAMC Palo Alto CA
INTERNIST NEEDED,"Brevard County, Florida",confidential
INTERVENTIONAL CARDIOLOGIST,"Rochester, New York",Rochester General Health System
GERIATRICIAN,"Washington, DC",Washington Hospital Center
ACADEMIC HOSPITALISTS NEEDED FOR NJ TEACHING HOSPITAL,New Jersey,confidential
"NEW JERSEY, MEDICAL ONCOLOGIST","Hunterdon County, New Jersey",Hunterdon Hematology Oncology
CLINICIAN INVESTIGATOR,Pittsburgh,"University of Pittsburgh, IM"
CLINICIAN,Pittsburgh,"University of Pittsburgh, IM"
CLINICIAN EDUCATOR,Pittsburgh,"University of Pittsburgh, IM"
"BILLINGS CLINIC, INTERNAL MEDICINE",Montana,Mountain Medical Group
"DIRECTOR OF RESEARCH, GEISINGER-NORTHEAST",Pennsylvania,Geisinger Health Systems
"HOSPITALISTS WANTED IN MELBOURNE, FLORIDA","Melbourne, Florida",Brevard Hospitalist Associates
THE AIMS HOSPITALIST GROUP AT SAINT FRANCIS HOSPITAL,"Stafford Springs, Connecticut",Saint Francis Hospital and Medical Center
"METRO NY AREA, IM or FM, BC/BE, IN-PATIENT",Metro New York,Geriatrics Services PC
NONINVASIVE CARDIOLOGIST WANTED,"Long Island, New York",confidential
INVASIVE NONINTERVENTIONAL CARDIOLOGIST,"Portland, Oregon/Vancouver, Washington",Northwest Cardiovascular Institute
"GENERAL CARDIOLOGY, HEART OF THE OREGON WINE COUNTRY",Oregon,Northwest Cardiovascular Institute
"IM/FP BC/BE, MD OR DO",Northern Arizona,Northern Arizona Medical Group
"SANSUM CLINIC, SANTA BARBARA","Santa Barbara, California",Sansum Clinic
HIGH PAYING INFECTIOUS DISEASE/SPECIALTY JOBS NATIONWIDE,Nationwide,RS PA
"ACADEMIC RHEUMATOLOGIST, CENTRAL CONNECTICUT",Central Connecticut,Saint Francis Hospital and Medical Center
HOSPITALIST,Pittsburgh,"University of Pittsburgh, IM"
"PRESBYTERIAN, NEW MEXICO",New Mexico,Presbyterian Healthcare Services
FIND YOUR PERFECT PRACTICE WITH PROVIDENCE,"Alaska, California, Montana, Oregon, and Washington",Providence Health and Services
WINCHESTER HOSPITAL,"Winchester, Massachusetts",Winchester Hospital
